{
  "schemaVersion": 1,
  "id": "product-lifecycle",
  "title": "Product lifecycle",
  "summary": "Connect market learning, product decisions, delivery, support, and continued improvement.",
  "stages": [
    {"id":"discover","purpose":"Understand users, needs, alternatives, and opportunity.","outputs":["Problem evidence","Assumptions and success measures"]},
    {"id":"validate","purpose":"Test whether the opportunity and proposed value merit investment.","outputs":["Experiment evidence","Fit assessment with recommendation and claim level","Human go decision and remaining uncertainty"]},
    {"id":"define","purpose":"Choose outcomes, requirements, scope, story map, and acceptance evidence.","outputs":["Outcome","Product requirements and story map","Acceptance criteria","Exclusions"]},
    {"id":"design","purpose":"Shape product, service, and technical choices and risks.","outputs":["Design and architecture decisions","Risk responses"]},
    {"id":"plan","purpose":"Order work and confirm readiness, ownership, and verification.","outputs":["Work plan","Dependencies","Criterion-linked test plan and verification approach"]},
    {"id":"deliver","purpose":"Build, verify, accept, and release the product change.","outputs":["Change","Verification evidence at the planned test level","JUnit or platform-native test report uploaded when supported","Release and rollback plan"]},
    {"id":"operate-support","purpose":"Operate the service and support users.","outputs":["Service and support evidence","Incidents and feedback"]},
    {"id":"learn-retire","purpose":"Measure outcomes, improve, or retire responsibly.","outputs":["Outcome review","Improvement or retirement decision"]}
  ],
  "roles": ["product-manager","market-researcher","architect","engineer","support-specialist","sales-specialist"],
  "subprocesses": ["market-validation","feature-request","bug","change","release","incident"],
  "statusAuthority": "Use the consumer's configured tracker or ask the user. This definition does not store work status."
}
