{
  "schemaVersion": 1,
  "id": "change",
  "title": "Change lifecycle",
  "summary": "Assess and deliver a change with proportionate decisions, evidence, and communication.",
  "entryConditions": ["A change to product behavior, policy, or operation is proposed"],
  "steps": [
    "State the motivation and affected outcomes",
    "Assess stakeholders, compatibility, and risk",
    "Choose an authorized approach and migration path; update architecture catalogs when decisions change",
    "Plan implementation and verification against coding standards",
    "Review evidence and required approvals",
    "Communicate, release, and learn"
  ],
  "outputs": ["Impact assessment","Decision and migration plan","Architecture catalog updates when applicable","Verification evidence","Release communication"],
  "roles": ["product-manager","architect","engineer","test-manager","devops"],
  "skills": ["ah-assess-tech-feasibility","ah-architecture","ah-coding-standards","ah-work","ah-test-plan","ah-write-tests","ah-pipeline","ah-gate"]
}
